{
    "id": 8211,
    "tenDuAn": "Gia Khải Luxury",
    "matDoXayDung": null,
    "dienTich": "2.31 ha",
    "khoiCong": "Tháng 12/2024",
    "loaiHinh": "Khu dân cư",
    "banGiaoDuKien": "Tháng 12/2025",
    "chuDauTu": "Công ty CPĐT Địa Ốc Gia Khải",
    "trangThai": "Đang mở bán",
    "viTri": "Xã An Điền, Thị xã Bến Cát, Bình Dương",
    "congTyThietKe": null,
    "viTriDesc": null,
    "tienIch": " width=device-width, initial-scale=1 Thông tin Dự án Gia Khải Luxury-Khởi công 12/2024-Bàn giao 12/2025-Chủ đầu tư Công ty CPĐT Địa Ốc Gia Khải-Loại hình Khu dân cư-Tổng diện tích 2.31 ha-Quy mô 144-Tiến độ Sắp thi công-Trạng thái Đang mở bán index, follow, noarchive Gia Khải Luxury Thị xã Bến Cát, Bình Dương cập nhật tháng 7/2025 Thông tin Dự án Gia Khải Luxury-Khởi công 12/2024-Bàn giao 12/2025-Chủ đầu tư Công ty CPĐT Địa Ốc Gia Khải-Loại hình Khu dân cư-Tổng diện tích 2.31 ha-Quy mô 144-Tiến độ Sắp thi công-Trạng thái Đang mở bán https://tracuuquyhoach.com/du-an/gia-khai-luxury-pj4906 https://cdn.chotot.com/-PsGc7y6m1S77AK4C72zTO2FIt3MD1c1ckSTtZ2TSeM/preset:property_project_large/plain/4906_overview_1732613532.jpg website summary_large_image Gia Khải Luxury Thị xã Bến Cát, Bình Dương cập nhật tháng 7/2025 Thông tin Dự án Gia Khải Luxury-Khởi công 12/2024-Bàn giao 12/2025-Chủ đầu tư Công ty CPĐT Địa Ốc Gia Khải-Loại hình Khu dân cư-Tổng diện tích 2.31 ha-Quy mô 144-Tiến độ Sắp thi công-Trạng thái Đang mở bán https://cdn.chotot.com/-PsGc7y6m1S77AK4C72zTO2FIt3MD1c1ckSTtZ2TSeM/preset:property_project_large/plain/4906_overview_1732613532.jpg",
    "tinh": 8,
    "quanHuyen": null,
    "xaPhuong": null,
    "images": "https://cdn.chotot.com/2i3BJc4Ptuvw6Bl26d4xkdEAr7PrLzFOcNEUy4HuaiA/preset:property_project_large/plain/4906_overview_1732613571.jpg,https://cdn.chotot.com/-PsGc7y6m1S77AK4C72zTO2FIt3MD1c1ckSTtZ2TSeM/preset:property_project_large/plain/4906_overview_1732613532.jpg,https://cdn.chotot.com/dAHDYQ1Q2yQilL2D187VwuLiEYbancnjlHH3NuFTdNE/preset:property_project_large/plain/4906_overview_1732613544.jpg,https://cdn.chotot.com/70vglAC1HR7eUP_L-iYd69-_TxG7-V61vw4iC5PT9iA/preset:property_project_large/plain/4906_overview_1732613553.jpg,https://cdn.chotot.com/Kb6PsPgzDd1jc4gahM7AAI-ASPmD49JU1V_T2g6nX2s/preset:property_project_large/plain/4906_overview_1732613562.jpg,https://cdn.chotot.com/2i3BJc4Ptuvw6Bl26d4xkdEAr7PrLzFOcNEUy4HuaiA/preset:property_project_large/plain/4906_overview_1732613571.jpg,https://cdn.chotot.com/-PsGc7y6m1S77AK4C72zTO2FIt3MD1c1ckSTtZ2TSeM/preset:property_project_large/plain/4906_overview_1732613532.jpg,https://cdn.chotot.com/dAHDYQ1Q2yQilL2D187VwuLiEYbancnjlHH3NuFTdNE/preset:property_project_large/plain/4906_overview_1732613544.jpg,https://cdn.chotot.com/70vglAC1HR7eUP_L-iYd69-_TxG7-V61vw4iC5PT9iA/preset:property_project_large/plain/4906_overview_1732613553.jpg,https://cdn.chotot.com/Kb6PsPgzDd1jc4gahM7AAI-ASPmD49JU1V_T2g6nX2s/preset:property_project_large/plain/4906_overview_1732613562.jpg,https://cdn.chotot.com/2i3BJc4Ptuvw6Bl26d4xkdEAr7PrLzFOcNEUy4HuaiA/preset:property_project_large/plain/4906_overview_1732613571.jpg",
    "toaDo": "11.136405, 106.554359",
    "polygon": "[[11.134804029670601,106.55573129653932],[11.137807210301634,106.55511975288393],[11.136332579471473,106.54995918273926],[11.134067953293082,106.55071020126344],[11.134804029670601,106.55573129653932]]",
    "donViThiCong": null,
    "dienTichXayDung": null,
    "dienTichSanXayDung": null,
    "dienTichMin": null,
    "dienTichMax": null,
    "gia_cung_khu_vuc": null,
    "giaMinPerM2": null,
    "giaMin": null,
    "soTangCao": null,
    "soTangHam": null,
    "soLuongCanHo": null,
    "soLuongDatNen": null,
    "soLuongBietThu": null,
    "soLuongNhaMatDat": null,
    "link": "https://tracuuquyhoach.com/du-an/gia-khai-luxury-pj4906",
    "test": null,
    "gioiThieu": "Đang mở bán\nSắp thi công\n\nThông tin dự án\nGiá mua bán\nN/A\nGiá cho thuê\nN/A\nKhởi công\nTháng 12/2024\nBàn giao\nTháng 12/2025\nChủ đầu tư\nCông ty CPĐT Địa Ốc Gia Khải\nLoại hình\nKhu dân cư\nTổng diện tích\n2.31 ha\nQuy mô\n144\nTiến độ\nSắp thi công\nTrạng thái\nĐang mở bán\n\nGiới thiệu dự án\nTổng quan dự án\nGia khải Luxury tọa lạc tại vị trí vàng ngay mặt tiền đại lộ Hùng Vương, P An Điền, TP Bến Cát. Với lợi thế vô cùng lớn khi sở hữu vị trí đắc địa đối diện chợ An Điền với khu dân cư hiện hữu, sầm uất và kinh tế phát triển hàng đầu khu vực.\nGia Khải Luxury Bến Cát tọa trên cung đường sầm uất và phát triển hàng đầu thành phố Bến Cát – Đại lộ Hùng Vương. Trong tương lai gần Gia Khải Luxury chính là điểm nhấn về sự sang trọng và đẳng cấp trên tuyến đường huyết mạch này.\nTên thương mại: Gia Khải Luxury\nChủ đầu tư: CTY CP ĐT PT Địa ốc Gia Khải\nĐơn vị phát triển: CTY CP ĐT PT Địa ốc Vương Phát Group.\nĐơn vị bán hàng: CTY TNHH Ngọc Khang Corporation.\nVị trí: Mặt tiền đường Hùng Vương, Phường An Điền, TP Bến Cát, Bình Dương.\nTổng diện tích: 2,3ha\nQuy mô: 144 căn nhà phố thương mại\nQuy cách xây dựng và bàn giao:\nMặt tiền đại lộ Hùng Vương: xây dựng 1 trệt 2 lầu (3 tầng) bàn giao hoàn thiện mặt ngoài và bàn giao thô bên trong.\nCác trục đường khác: xây dựng 1 trệt 1 lầu (2 tầng) bàn giao full nội thất như căn hộ chung cư.\nDiện tích đất điển hình: 63 m2 – 161 m2.\nDiện tích sàn xây dựng: 120 m2 – 388 m2.\nGia Khải Luxury Bến Cát – kết nối ngàn tiện ích trong tầm tay. Chỉ với chưa đầy 3 phút di chuyển Bạn đã có thể kết nối với mọi tiện ích quan trọng hàng đầu tại khu vực như:\nChợ An Điền – đối diện.\nCụm khu công nghiệp Rạch Bắp và các cụm công nghiệp khác.\nTrường học các cấp.\nỦy ban nhân dân và Trung tâm hành chính.\nPhố thương mại trong lòng dự án.\nKhu vui chơi trẻ em và nhiều tiện ích khác.\n\nChủ đầu tư\nCông ty CPĐT Địa Ốc Gia Khải\nThành lập từ\nN/A\nSố dự án\n1",
    "chiTiet": " width=device-width, initial-scale=1 Thông tin Dự án Gia Khải Luxury-Khởi công 12/2024-Bàn giao 12/2025-Chủ đầu tư Công ty CPĐT Địa Ốc Gia Khải-Loại hình Khu dân cư-Tổng diện tích 2.31 ha-Quy mô 144-Tiến độ Sắp thi công-Trạng thái Đang mở bán index, follow, noarchive Gia Khải Luxury Thị xã Bến Cát, Bình Dương cập nhật tháng 7/2025 Thông tin Dự án Gia Khải Luxury-Khởi công 12/2024-Bàn giao 12/2025-Chủ đầu tư Công ty CPĐT Địa Ốc Gia Khải-Loại hình Khu dân cư-Tổng diện tích 2.31 ha-Quy mô 144-Tiến độ Sắp thi công-Trạng thái Đang mở bán https://tracuuquyhoach.com/du-an/gia-khai-luxury-pj4906 https://cdn.chotot.com/-PsGc7y6m1S77AK4C72zTO2FIt3MD1c1ckSTtZ2TSeM/preset:property_project_large/plain/4906_overview_1732613532.jpg website summary_large_image Gia Khải Luxury Thị xã Bến Cát, Bình Dương cập nhật tháng 7/2025 Thông tin Dự án Gia Khải Luxury-Khởi công 12/2024-Bàn giao 12/2025-Chủ đầu tư Công ty CPĐT Địa Ốc Gia Khải-Loại hình Khu dân cư-Tổng diện tích 2.31 ha-Quy mô 144-Tiến độ Sắp thi công-Trạng thái Đang mở bán https://cdn.chotot.com/-PsGc7y6m1S77AK4C72zTO2FIt3MD1c1ckSTtZ2TSeM/preset:property_project_large/plain/4906_overview_1732613532.jpg",
    "tongVonDauTu": null,
    "congTrinhCongCong": null
}