{
    "id": 8380,
    "tenDuAn": "Richland Residence",
    "matDoXayDung": null,
    "dienTich": "N/A",
    "khoiCong": "Tháng 01/0001",
    "loaiHinh": "Biệt thự, liền kề",
    "banGiaoDuKien": "Tháng 01/0001",
    "chuDauTu": "Kim Oanh",
    "trangThai": "Sắp mở bán",
    "viTri": "Phường Hòa Lợi, Thị xã Bến Cát, Bình Dương",
    "congTyThietKe": null,
    "viTriDesc": null,
    "tienIch": " width=device-width, initial-scale=1 Thông tin Dự án Richland Residence-Giá bán từ 13.900.000/m2-Khởi công 01/0001-Bàn giao 01/0001-Chủ đầu tư Kim Oanh-Loại hình Biệt thự, liền kề-Tiến độ Đang thi công-Trạng thái Sắp mở bán index, follow, noarchive Richland Residence Thị xã Bến Cát, Bình Dương cập nhật tháng 7/2025 Thông tin Dự án Richland Residence-Giá bán từ 13.900.000/m2-Khởi công 01/0001-Bàn giao 01/0001-Chủ đầu tư Kim Oanh-Loại hình Biệt thự, liền kề-Tiến độ Đang thi công-Trạng thái Sắp mở bán https://tracuuquyhoach.com/du-an/richland-residence-pj4839 https://cdn.chotot.com/BL3thH0UJA0GgNc8rm-kyxFyX-agZkU_G1gGMayuRQ0/preset:property_project_large/plain/4839_overview_1670393552.jpg website summary_large_image Richland Residence Thị xã Bến Cát, Bình Dương cập nhật tháng 7/2025 Thông tin Dự án Richland Residence-Giá bán từ 13.900.000/m2-Khởi công 01/0001-Bàn giao 01/0001-Chủ đầu tư Kim Oanh-Loại hình Biệt thự, liền kề-Tiến độ Đang thi công-Trạng thái Sắp mở bán https://cdn.chotot.com/BL3thH0UJA0GgNc8rm-kyxFyX-agZkU_G1gGMayuRQ0/preset:property_project_large/plain/4839_overview_1670393552.jpg",
    "tinh": 8,
    "quanHuyen": null,
    "xaPhuong": null,
    "images": "https://cdn.chotot.com/vMz50P0fQv5PIdLexkMNlbad2SIZWhYEoImcjltDVLo/preset:property_project_large/plain/4839_overview_1670393573.jpg,https://cdn.chotot.com/BL3thH0UJA0GgNc8rm-kyxFyX-agZkU_G1gGMayuRQ0/preset:property_project_large/plain/4839_overview_1670393552.jpg,https://cdn.chotot.com/HSbypr4SsyEeWTo8hsIJSfj1jbpo9yDPpMOTURv6bhE/preset:property_project_large/plain/4839_floor_plan_project_1670393586.jpg,https://cdn.chotot.com/SV7abDovY2Do1f63XvRGf--zUdu1rbRnRIYnUoojzro/preset:property_project_large/plain/4839_overview_1670393562.jpg,https://cdn.chotot.com/vMz50P0fQv5PIdLexkMNlbad2SIZWhYEoImcjltDVLo/preset:property_project_large/plain/4839_overview_1670393573.jpg,https://cdn.chotot.com/BL3thH0UJA0GgNc8rm-kyxFyX-agZkU_G1gGMayuRQ0/preset:property_project_large/plain/4839_overview_1670393552.jpg,https://cdn.chotot.com/HSbypr4SsyEeWTo8hsIJSfj1jbpo9yDPpMOTURv6bhE/preset:property_project_large/plain/4839_floor_plan_project_1670393586.jpg,https://cdn.chotot.com/SV7abDovY2Do1f63XvRGf--zUdu1rbRnRIYnUoojzro/preset:property_project_large/plain/4839_overview_1670393562.jpg,https://cdn.chotot.com/vMz50P0fQv5PIdLexkMNlbad2SIZWhYEoImcjltDVLo/preset:property_project_large/plain/4839_overview_1670393573.jpg",
    "toaDo": "11.117746, 106.673906",
    "polygon": "[[11.118163017165946,106.67367339134218],[11.117973409405524,106.67502522468568],[11.116403873765108,106.67478919029237],[11.116593482546158,106.67350172996521],[11.118163017165946,106.67367339134218]]",
    "donViThiCong": null,
    "dienTichXayDung": null,
    "dienTichSanXayDung": null,
    "dienTichMin": null,
    "dienTichMax": null,
    "gia_cung_khu_vuc": null,
    "giaMinPerM2": null,
    "giaMin": null,
    "soTangCao": null,
    "soTangHam": null,
    "soLuongCanHo": null,
    "soLuongDatNen": null,
    "soLuongBietThu": null,
    "soLuongNhaMatDat": null,
    "link": "https://tracuuquyhoach.com/du-an/richland-residence-pj4839",
    "test": null,
    "gioiThieu": "Sắp mở bán\nĐang thi công\n\nThông tin dự án\nGiá mua bán\nTừ 13.900.000/m2\nGiá cho thuê\nN/A\nKhởi công\nTháng 01/0001\nBàn giao\nTháng 01/0001\nChủ đầu tư\nKim Oanh\nLoại hình\nBiệt thự, liền kề\nTổng diện tích\nN/A\nQuy mô\nN/A\nTiến độ\nĐang thi công\nTrạng thái\nSắp mở bán\n\nGiới thiệu dự án\n<p><strong>Richland Residence</strong> l&agrave; khu đ&ocirc; thị thương mại - dịch vụ do Kim Oanh Group triển khai đầu tư, tọa lạc ngay v&ugrave;ng l&otilde;i ph&aacute;t triển của thị x&atilde; Bến C&aacute;t, liền kề Th&agrave;nh phố mới B&igrave;nh Dương. Dự &aacute;n Richland Residence c&oacute; tổng diện t&iacute;ch quy hoạch 15,46ha, quy m&ocirc; gồm 977 sản phẩm đất nền, nh&agrave; phố v&agrave; shophouse.&nbsp;</p>\n\nChủ đầu tư\nCÔNG TY CỔ PHẦN DỊCH VỤ THƯƠNG MẠI & XÂY DỰNG ĐỊA ỐC KIM OANH\nThành lập từ\nN/A\nSố dự án\n14\nSau hơn năm năm hình thành và phát triển, đến nay, bên cạnh trụ sở chính tại Bình Dương, Công ty Kim \nOanh đã xây dựng được hệ thống gồm 5 chi nhánh tại Bình Dương, TPHCM và Đồng Nai với gần 600 \nnhân viên luôn phục vụ tận tâm, chuyên nghiệp, đáp ứng mọi nhu cầu của khách hàng trong thời \ngian nhanh nhất. Vốn điều lệ của Kim Oanh hiện nay là 48 tỉ đồng trong khi tổng vốn huy động là \nhơn 500 tỉ đồng. \nTừ đầu năm 2015, Công ty Kim Oanh đã góp vốn thành lập 3 đơn vị thành viên gồm Công ty cổ phần \nĐầu tư Phát triển Dự án Thuận Lợi, Công ty cổ phần Đầu tư Phát triển Dự án Phú Thuận Lợi và Công ty \ncổ phần Xây dựng An Phước Bình Dương để hình thành Kim Oanh Group nhằm khép kín quy trình đầu \ntư chuỗi giá trị gia tăng cho các dự án bất động sản.",
    "chiTiet": " width=device-width, initial-scale=1 Thông tin Dự án Richland Residence-Giá bán từ 13.900.000/m2-Khởi công 01/0001-Bàn giao 01/0001-Chủ đầu tư Kim Oanh-Loại hình Biệt thự, liền kề-Tiến độ Đang thi công-Trạng thái Sắp mở bán index, follow, noarchive Richland Residence Thị xã Bến Cát, Bình Dương cập nhật tháng 7/2025 Thông tin Dự án Richland Residence-Giá bán từ 13.900.000/m2-Khởi công 01/0001-Bàn giao 01/0001-Chủ đầu tư Kim Oanh-Loại hình Biệt thự, liền kề-Tiến độ Đang thi công-Trạng thái Sắp mở bán https://tracuuquyhoach.com/du-an/richland-residence-pj4839 https://cdn.chotot.com/HSbypr4SsyEeWTo8hsIJSfj1jbpo9yDPpMOTURv6bhE/preset:property_project_large/plain/4839_floor_plan_project_1670393586.jpg website summary_large_image Richland Residence Thị xã Bến Cát, Bình Dương cập nhật tháng 7/2025 Thông tin Dự án Richland Residence-Giá bán từ 13.900.000/m2-Khởi công 01/0001-Bàn giao 01/0001-Chủ đầu tư Kim Oanh-Loại hình Biệt thự, liền kề-Tiến độ Đang thi công-Trạng thái Sắp mở bán https://cdn.chotot.com/HSbypr4SsyEeWTo8hsIJSfj1jbpo9yDPpMOTURv6bhE/preset:property_project_large/plain/4839_floor_plan_project_1670393586.jpg",
    "tongVonDauTu": null,
    "congTrinhCongCong": null
}