{
    "id": 8382,
    "tenDuAn": "The Oasis Riverside",
    "matDoXayDung": null,
    "dienTich": "25 ha",
    "khoiCong": "Tháng 01/0001",
    "loaiHinh": "Biệt thự, liền kề",
    "banGiaoDuKien": "Tháng 01/0001",
    "chuDauTu": "Bắc Sài Gòn (SNI)",
    "trangThai": "Sắp mở bán",
    "viTri": "Phường Thới Hòa, Thị xã Bến Cát, Bình Dương",
    "congTyThietKe": null,
    "viTriDesc": null,
    "tienIch": "Thông tin dự án\nGiá mua bán\nN/A\nGiá cho thuê\nN/A\nKhởi công\nTháng 01/0001\nBàn giao\nTháng 01/0001\nChủ đầu tư\nBắc Sài Gòn (SNI)\nLoại hình\nBiệt thự, liền kề\nTổng diện tích\n25 ha\nQuy mô\n1200 căn\nTiến độ\nĐang thi công\nTrạng thái\nSắp mở bán\n\nGiới thiệu dự án\n<p><strong>Dự &aacute;n The Oasis Riverside</strong> l&agrave; khu nh&agrave; ở dạng compound kh&eacute;p k&iacute;n ở Bến C&aacute;t, B&igrave;nh Dương, do C&ocirc;ng ty Cổ phần Quốc tế Bắc S&agrave;i G&ograve;n (SNI) đầu tư triển khai, ph&acirc;n phối độc quyền bởi C&ocirc;ng ty TNHH Thiết kế X&acirc;y dựng Việt Nh&acirc;n.</p>\n<p>The Oasis Riverside c&oacute; quy m&ocirc; gần 25ha, gồm 1200 sản phẩm nh&agrave; ở đa dạng, sẽ được ph&aacute;t triển đồng thời với Đại học Quốc tế Việt Đức.</p>\n<p>Vị tr&iacute; dự &aacute;n The Oasis Riverside được xem l&agrave; vị tr&iacute; &ldquo;kim cương&rdquo;, nổi bật nhất khu vực Bến C&aacute;t, B&igrave;nh Dương. Từ dự &aacute;n The Oasis Riverside Bến C&aacute;t, cư d&acirc;n c&oacute; thể dễ d&agrave;ng kết nối với 5 tỉnh th&agrave;nh ph&iacute;a Nam, gồm: TP.HCM, B&igrave;nh Dương, Đồng Nai, B&igrave;nh Phước, T&acirc;y Ninh.&nbsp;</p>\n<p>B&ecirc;n cạnh kết nối c&aacute;c tuyến đường ch&iacute;nh, c&oacute; nhiều trạm dừng xe bu&yacute;t nằm c&aacute;ch dự &aacute;n n&agrave;y khoảng 6-8 ph&uacute;t di chuyển. Hệ thống giao th&ocirc;ng c&ocirc;ng cộng của Bến C&aacute;t kh&aacute; ph&aacute;t triển, cho ph&eacute;p người d&acirc;n dễ d&agrave;ng đến bất kỳ điểm đến n&agrave;o th&ocirc;ng qua c&aacute;c dịch vụ xe bu&yacute;t v&agrave; taxi m&agrave; kh&ocirc;ng gặp trở ngại..</p>\n\nChủ đầu tư\nCông ty Cổ phần Quốc tế Bắc Sài Gòn\nThành lập từ\nN/A\nSố dự án\n2\nThe Oasis, với sự quy hoạch tổng thể bài bản ngay từ đầu, cộng với sự kết hợp nét kiến trúc nhà truyển thống Việt với đặc trưng xanh, sạch, hài hòa của Singapore đã hình thành một The Oasis đặc trưng không lẫn được với các khu dân cư hiện hữu tại Bình Dương, như đúng với tên gọi “ốc đảo” (The Oasis) của dự án. \n\nCác dãy nhà theo thiết kế villa với mái ngói đỏ, những hàng cây xanh mát, tỉ lệ xây dựng thấp ( khoảng 20% trên tổng diện tích đất của dự án) với nhiều tiện ích công cộng nội khu như: hồ bơi, phòng tập thể dục, nhà hàng và toàn khu biệt lập với bên ngoài nhờ hàng rào bao quanh kiên cố cộng với dịch vụ bảo vệ 24/7 chuyên nghiệp và tận tình mang lại cảm giác tiện nghi, thoải mái, an toàn, hài lòng cho cư dân tại đây đáp ứng nhu cầu nghỉ ngơi lý tưởng cho cư dân sau thời gian làm việc tại doanh nghiệp. \n\nSNI là một công ty đi tiên phong trong lĩnh vực xây dựng khu biệt thự nghỉ dưỡng cho chuyên gia nước ngoài tại Bình Dương, với thế mạnh dựa trên sự am hiểu địa phương cùng với đội ngũ nhân viên trẻ, nhiệt tình, năng động và đội ngũ chuyên gia nước ngoài có kinh nghiệm nhiều năm trong lĩnh vực bất động sản . Điều này đã giúp công ty SNI xây dựng được dự án The Oasis có tên tuổi trong thị trường bất động sản năng động và đầy thách thức của Bình Dương. \n\nQua hơn mười (10) năm hình thành và phát triển, SNI luôn thể hiện là chủ đầu tư có trách nhiệm và luôn đồng hành cùng khách hàng. SNI đã hoàn thành dự án và bàn giao hơn 500 sổ hồng cho quý khách với tổng số 652 căn biệt thự, đây là niềm tự hào của toàn thể nhân viên SNI. Hiện nay, SNI vẫn tiếp tục gắn bó với khách hàng trong việc quản lý dự án sau khi nhà đã được bàn giao và vận hành khai thác cho thuê giúp khách hàng đầu tư nhà hiệu quả với giá cho thuê mỗi căn biệt thự tương đối cao. Với hơn 460 chuyên gia nước ngoài đang sinh sống tại The Oasis bao gồm mười bảy (17) quốc tịch khác nhau, chính điều này đã giúp hình thành thương hiệu và bản sắc riêng cho Công ty SNI nói chung hay thương hiệu dự án The Oasis nói riêng.",
    "tinh": 8,
    "quanHuyen": null,
    "xaPhuong": null,
    "images": "https://cdn.chotot.com/oexodL1U3jYzWzB7aBXSxAftVyx-1Efxt5csbiYRNtA/preset:property_project_large/plain/4837_overview_1670363566.jpg,https://cdn.chotot.com/9MiS226OuAhlTFukOeX0-Q6kdAyPn9LmwCP5Tv3Hrns/preset:property_project_large/plain/4837_overview_1670363493.jpg,https://cdn.chotot.com/1HXkUZTWZ3O09yO2X961NwiEJ2-mzwJtvIvc5GuIZ3k/preset:property_project_large/plain/4837_floor_plan_project_1670363584.jpg,https://cdn.chotot.com/d8VPggDsLwihOF6MCAXz3OlLtceRFAmQ9rtUYo6huy0/preset:property_project_large/plain/4837_overview_1670363515.jpg,https://cdn.chotot.com/79T8hv_sBGGoNC0rAY5f0CI-NrEbV_K85kNmsuAG_nk/preset:property_project_large/plain/4837_overview_1670363537.jpg,https://cdn.chotot.com/IiHhWGfFP1lf835NRDtab5Bxq2JtrGB6coY-3j5ez60/preset:property_project_large/plain/4837_overview_1670363552.jpg,https://cdn.chotot.com/oexodL1U3jYzWzB7aBXSxAftVyx-1Efxt5csbiYRNtA/preset:property_project_large/plain/4837_overview_1670363566.jpg,https://cdn.chotot.com/9MiS226OuAhlTFukOeX0-Q6kdAyPn9LmwCP5Tv3Hrns/preset:property_project_large/plain/4837_overview_1670363493.jpg,https://cdn.chotot.com/1HXkUZTWZ3O09yO2X961NwiEJ2-mzwJtvIvc5GuIZ3k/preset:property_project_large/plain/4837_floor_plan_project_1670363584.jpg,https://cdn.chotot.com/d8VPggDsLwihOF6MCAXz3OlLtceRFAmQ9rtUYo6huy0/preset:property_project_large/plain/4837_overview_1670363515.jpg,https://cdn.chotot.com/79T8hv_sBGGoNC0rAY5f0CI-NrEbV_K85kNmsuAG_nk/preset:property_project_large/plain/4837_overview_1670363537.jpg,https://cdn.chotot.com/IiHhWGfFP1lf835NRDtab5Bxq2JtrGB6coY-3j5ez60/preset:property_project_large/plain/4837_overview_1670363552.jpg,https://cdn.chotot.com/oexodL1U3jYzWzB7aBXSxAftVyx-1Efxt5csbiYRNtA/preset:property_project_large/plain/4837_overview_1670363566.jpg",
    "toaDo": "11.117746, 106.673906",
    "polygon": "[[11.117415119172703,106.67357683181764],[11.118236753483904,106.67367339134218],[11.117983943173222,106.67501449584962],[11.117288713688556,106.67489647865295],[11.117415119172703,106.67357683181764]]",
    "donViThiCong": null,
    "dienTichXayDung": null,
    "dienTichSanXayDung": null,
    "dienTichMin": null,
    "dienTichMax": null,
    "gia_cung_khu_vuc": null,
    "giaMinPerM2": null,
    "giaMin": null,
    "soTangCao": null,
    "soTangHam": null,
    "soLuongCanHo": null,
    "soLuongDatNen": null,
    "soLuongBietThu": null,
    "soLuongNhaMatDat": null,
    "link": "https://tracuuquyhoach.com/du-an/the-oasis-riverside-pj4837",
    "test": null,
    "gioiThieu": "Thông tin dự án\nGiá mua bán\nN/A\nGiá cho thuê\nN/A\nKhởi công\nTháng 01/0001\nBàn giao\nTháng 01/0001\nChủ đầu tư\nBắc Sài Gòn (SNI)\nLoại hình\nBiệt thự, liền kề\nTổng diện tích\n25 ha\nQuy mô\n1200 căn\nTiến độ\nĐang thi công\nTrạng thái\nSắp mở bán\n\nGiới thiệu dự án\n<p><strong>Dự &aacute;n The Oasis Riverside</strong> l&agrave; khu nh&agrave; ở dạng compound kh&eacute;p k&iacute;n ở Bến C&aacute;t, B&igrave;nh Dương, do C&ocirc;ng ty Cổ phần Quốc tế Bắc S&agrave;i G&ograve;n (SNI) đầu tư triển khai, ph&acirc;n phối độc quyền bởi C&ocirc;ng ty TNHH Thiết kế X&acirc;y dựng Việt Nh&acirc;n.</p>\n<p>The Oasis Riverside c&oacute; quy m&ocirc; gần 25ha, gồm 1200 sản phẩm nh&agrave; ở đa dạng, sẽ được ph&aacute;t triển đồng thời với Đại học Quốc tế Việt Đức.</p>\n<p>Vị tr&iacute; dự &aacute;n The Oasis Riverside được xem l&agrave; vị tr&iacute; &ldquo;kim cương&rdquo;, nổi bật nhất khu vực Bến C&aacute;t, B&igrave;nh Dương. Từ dự &aacute;n The Oasis Riverside Bến C&aacute;t, cư d&acirc;n c&oacute; thể dễ d&agrave;ng kết nối với 5 tỉnh th&agrave;nh ph&iacute;a Nam, gồm: TP.HCM, B&igrave;nh Dương, Đồng Nai, B&igrave;nh Phước, T&acirc;y Ninh.&nbsp;</p>\n<p>B&ecirc;n cạnh kết nối c&aacute;c tuyến đường ch&iacute;nh, c&oacute; nhiều trạm dừng xe bu&yacute;t nằm c&aacute;ch dự &aacute;n n&agrave;y khoảng 6-8 ph&uacute;t di chuyển. Hệ thống giao th&ocirc;ng c&ocirc;ng cộng của Bến C&aacute;t kh&aacute; ph&aacute;t triển, cho ph&eacute;p người d&acirc;n dễ d&agrave;ng đến bất kỳ điểm đến n&agrave;o th&ocirc;ng qua c&aacute;c dịch vụ xe bu&yacute;t v&agrave; taxi m&agrave; kh&ocirc;ng gặp trở ngại..</p>\n\nChủ đầu tư\nCông ty Cổ phần Quốc tế Bắc Sài Gòn\nThành lập từ\nN/A\nSố dự án\n2\nThe Oasis, với sự quy hoạch tổng thể bài bản ngay từ đầu, cộng với sự kết hợp nét kiến trúc nhà truyển thống Việt với đặc trưng xanh, sạch, hài hòa của Singapore đã hình thành một The Oasis đặc trưng không lẫn được với các khu dân cư hiện hữu tại Bình Dương, như đúng với tên gọi “ốc đảo” (The Oasis) của dự án. \n\nCác dãy nhà theo thiết kế villa với mái ngói đỏ, những hàng cây xanh mát, tỉ lệ xây dựng thấp ( khoảng 20% trên tổng diện tích đất của dự án) với nhiều tiện ích công cộng nội khu như: hồ bơi, phòng tập thể dục, nhà hàng và toàn khu biệt lập với bên ngoài nhờ hàng rào bao quanh kiên cố cộng với dịch vụ bảo vệ 24/7 chuyên nghiệp và tận tình mang lại cảm giác tiện nghi, thoải mái, an toàn, hài lòng cho cư dân tại đây đáp ứng nhu cầu nghỉ ngơi lý tưởng cho cư dân sau thời gian làm việc tại doanh nghiệp. \n\nSNI là một công ty đi tiên phong trong lĩnh vực xây dựng khu biệt thự nghỉ dưỡng cho chuyên gia nước ngoài tại Bình Dương, với thế mạnh dựa trên sự am hiểu địa phương cùng với đội ngũ nhân viên trẻ, nhiệt tình, năng động và đội ngũ chuyên gia nước ngoài có kinh nghiệm nhiều năm trong lĩnh vực bất động sản . Điều này đã giúp công ty SNI xây dựng được dự án The Oasis có tên tuổi trong thị trường bất động sản năng động và đầy thách thức của Bình Dương. \n\nQua hơn mười (10) năm hình thành và phát triển, SNI luôn thể hiện là chủ đầu tư có trách nhiệm và luôn đồng hành cùng khách hàng. SNI đã hoàn thành dự án và bàn giao hơn 500 sổ hồng cho quý khách với tổng số 652 căn biệt thự, đây là niềm tự hào của toàn thể nhân viên SNI. Hiện nay, SNI vẫn tiếp tục gắn bó với khách hàng trong việc quản lý dự án sau khi nhà đã được bàn giao và vận hành khai thác cho thuê giúp khách hàng đầu tư nhà hiệu quả với giá cho thuê mỗi căn biệt thự tương đối cao. Với hơn 460 chuyên gia nước ngoài đang sinh sống tại The Oasis bao gồm mười bảy (17) quốc tịch khác nhau, chính điều này đã giúp hình thành thương hiệu và bản sắc riêng cho Công ty SNI nói chung hay thương hiệu dự án The Oasis nói riêng.",
    "chiTiet": " width=device-width, initial-scale=1 Thông tin Dự án The Oasis Riverside-Khởi công 01/0001-Bàn giao 01/0001-Chủ đầu tư Bắc Sài Gòn (SNI)-Loại hình Biệt thự, liền kề-Tổng diện tích 25 ha-Quy mô 1200 căn-Tiến độ Đang thi công-Trạng thái Sắp mở bán index, follow, noarchive The Oasis Riverside Thị xã Bến Cát, Bình Dương cập nhật tháng 7/2025 Thông tin Dự án The Oasis Riverside-Khởi công 01/0001-Bàn giao 01/0001-Chủ đầu tư Bắc Sài Gòn (SNI)-Loại hình Biệt thự, liền kề-Tổng diện tích 25 ha-Quy mô 1200 căn-Tiến độ Đang thi công-Trạng thái Sắp mở bán https://tracuuquyhoach.com/du-an/the-oasis-riverside-pj4837 https://cdn.chotot.com/9MiS226OuAhlTFukOeX0-Q6kdAyPn9LmwCP5Tv3Hrns/preset:property_project_large/plain/4837_overview_1670363493.jpg website summary_large_image The Oasis Riverside Thị xã Bến Cát, Bình Dương cập nhật tháng 7/2025 Thông tin Dự án The Oasis Riverside-Khởi công 01/0001-Bàn giao 01/0001-Chủ đầu tư Bắc Sài Gòn (SNI)-Loại hình Biệt thự, liền kề-Tổng diện tích 25 ha-Quy mô 1200 căn-Tiến độ Đang thi công-Trạng thái Sắp mở bán https://cdn.chotot.com/9MiS226OuAhlTFukOeX0-Q6kdAyPn9LmwCP5Tv3Hrns/preset:property_project_large/plain/4837_overview_1670363493.jpg",
    "tongVonDauTu": null,
    "congTrinhCongCong": null
}