{
    "id": 8409,
    "tenDuAn": "Regal Victoria",
    "matDoXayDung": null,
    "dienTich": "N/A",
    "khoiCong": "Tháng 01/0001",
    "loaiHinh": "Biệt thự, liền kề",
    "banGiaoDuKien": "Tháng 01/0001",
    "chuDauTu": "Đất Xanh Miền Trung",
    "trangThai": "Đang mở bán",
    "viTri": "Phường Điện Ngọc, Thị xã Điện Bàn, Quảng Nam",
    "congTyThietKe": null,
    "viTriDesc": null,
    "tienIch": "Thông tin dự án\nGiá mua bán\nN/A\nGiá cho thuê\nN/A\nKhởi công\nTháng 01/0001\nBàn giao\nTháng 01/0001\nChủ đầu tư\nĐất Xanh Miền Trung\nLoại hình\nBiệt thự, liền kề\nTổng diện tích\nN/A\nQuy mô\n67 căn biệt thự siêu sang\nTiến độ\nĐang thi công\nTrạng thái\nĐang mở bán\n\nGiới thiệu dự án\n1, Tổng quan dự án:\nRegal Victoria là khu biệt thự đảo ngọc quốc tế, mang đến hai thái cực sống tuyệt vời cho chủ nhân. Một bên là cuộc sống riêng tư, xa hoa bên trong căn villa 5 sao thuộc thương hiệu Regal do Đất Xanh Miền Trung phát triển với ngôn ngữ kiến trúc mạnh mẽ, hiện đại, đột phá. Một bên là thế giới tiện ích nghỉ dưỡng trọn vẹn, từ khu công viên và sân thể thao phức hợp cao cấp tới chuỗi resort, khách sạn 5 sao từ các thương hiệu hàng đầu thế giới, khu sân golf chuẩn quốc tế.\nRegal Victoria chính là lựa chọn tinh tế của những chủ nhân coi trọng một lối sống thấu hiểu và chăm sóc sức khỏe, riêng tư và giàu trải nghiệm với những tiện ích quý giá.\nThông tin dự án:\nĐịa chỉ: Quần thể khu đô thị One World Regency 22ha – phường Điện Ngọc – thị xã Điện Bàn – tỉnh Quảng Nam.\nLoại hình sản phẩm: Biệt thự đảo, biệt thự ở kết hợp kinh doanh\nQuy mô: 67 căn biệt thự siêu sang để bán và Regal Food\nĐơn vị phát triển: Regal Homes\nChủ đầu tư: Đất Xanh Miền Trung\nVận hành và khai thác: Smart Property\nĐơn vị phân phối: Công ty Cổ phần Đô Thị Thông Minh Việt Nam (Vietnam Smart City)\n2, Vị trí:\nRegal Victoria sở hữu vị trí sinh thái cho một cuộc sống hòa mình vào thiên nhiên xanh mát – gần biển, ven sông, sở hữu hồ sinh thái và kênh đào điều hòa ngay bên trong dự án.\nNơi đây cũng là tâm điểm phồn hoa và sẽ sớm nằm trên hai cung đường quan trọng nối liền Đà Nẵng, Hội An – cung đường bộ Võ Nguyên Giáp ven biển và cung đường thủy đang được triển khai thông qua đề án khơi thông sông Cổ Cò.\nTừ đây, Regal Victoria sẽ trở thành tâm điểm du lịch, nghỉ dưỡng sinh thái đắc địa cho du khách trên tuyến du lịch được yêu thích nhất của du khách khi tới Việt Nam: Đà Nẵng – Hội An.\n\nChủ đầu tư\nĐất Xanh Miền Trung\nThành lập từ\nN/A\nSố dự án\n13\nTháng 11/2003 thương hiệu Ðất Xanh chính thức có mặt trên thị truờng bất động sản Việt Nam. Trải qua 13 năm hình thành và phát triển, Ðất Xanh luôn vững vàng với mục tiêu mang lại cho khách hàng những sản phẩm bất động sản tốt nhất bằng dịch vụ chuyên nghiệp nhất.Với tiềm lực mạnh về tài chính, vững vàng về kinh nghiệm, cùng đội ngũ cán bộ nhân viên được đào tạo chuyên nghiệp, nhiệt tình, năng động, sáng tạo và làm việc hiệu quả, Ðất Xanh nỗ lực không ngừng trong mọi hoàn cảnh để khẳng định và nâng cao vị thế của mình trên thị trường bất động sản Việt Nam, giữ vững niềm tin trong tâm trí khách hàng và đối tác.Tự tin với sức mạnh của ba mũi nhọn là Ðầu tư - Xây dựng - Dịch vụ, Ðất Xanh đã và đang khẳng định vị thế là Nhà cung cấp giải pháp bất động sản toàn diện nhằm tạo lập cuộc sống ưu việt cho khách hàng.Với chiến lược đa ngành nghề, đa sở hữu và đa quốc gia, Đất Xanh chủ trương liên doanh, liên kết, hợp tác với các tổ chức Tài chính, Ngân hàng, Công nghệ, Nhân lực...nhằm tối ưu hóa lợi thế cạnh tranh trên thị trường. Đất Xanh là một trong những doanh nghiệp có được nét văn hóa riêng, tạo được môi trường lý tưởng cho mọi người phát triển sự nghiệp trong lĩnh vực bất động sản, đồng thời đề cao mục tiêu phát triển doanh nghiệp gắn với sự phát triển xã hội, luôn có những hành động thiết thực chung tay vì một cộng đồng bền vững và nhân ái.",
    "tinh": 47,
    "quanHuyen": null,
    "xaPhuong": null,
    "images": "",
    "toaDo": "15.958846, 108.273948",
    "polygon": "[[15.95782434993476,108.2717764377594],[15.96128204094536,108.27238798141481],[15.960838221258447,108.27509164810182],[15.957617918733108,108.27479124069215],[15.959351934217015,108.27348232269289],[15.95782434993476,108.2717764377594]]",
    "donViThiCong": null,
    "dienTichXayDung": null,
    "dienTichSanXayDung": null,
    "dienTichMin": null,
    "dienTichMax": null,
    "gia_cung_khu_vuc": null,
    "giaMinPerM2": null,
    "giaMin": null,
    "soTangCao": null,
    "soTangHam": null,
    "soLuongCanHo": null,
    "soLuongDatNen": null,
    "soLuongBietThu": null,
    "soLuongNhaMatDat": null,
    "link": "https://tracuuquyhoach.com/du-an/regal-victoria-pj4810",
    "test": null,
    "gioiThieu": "Thông tin dự án\nGiá mua bán\nN/A\nGiá cho thuê\nN/A\nKhởi công\nTháng 01/0001\nBàn giao\nTháng 01/0001\nChủ đầu tư\nĐất Xanh Miền Trung\nLoại hình\nBiệt thự, liền kề\nTổng diện tích\nN/A\nQuy mô\n67 căn biệt thự siêu sang\nTiến độ\nĐang thi công\nTrạng thái\nĐang mở bán\n\nGiới thiệu dự án\n1, Tổng quan dự án:\nRegal Victoria là khu biệt thự đảo ngọc quốc tế, mang đến hai thái cực sống tuyệt vời cho chủ nhân. Một bên là cuộc sống riêng tư, xa hoa bên trong căn villa 5 sao thuộc thương hiệu Regal do Đất Xanh Miền Trung phát triển với ngôn ngữ kiến trúc mạnh mẽ, hiện đại, đột phá. Một bên là thế giới tiện ích nghỉ dưỡng trọn vẹn, từ khu công viên và sân thể thao phức hợp cao cấp tới chuỗi resort, khách sạn 5 sao từ các thương hiệu hàng đầu thế giới, khu sân golf chuẩn quốc tế.\nRegal Victoria chính là lựa chọn tinh tế của những chủ nhân coi trọng một lối sống thấu hiểu và chăm sóc sức khỏe, riêng tư và giàu trải nghiệm với những tiện ích quý giá.\nThông tin dự án:\nĐịa chỉ: Quần thể khu đô thị One World Regency 22ha – phường Điện Ngọc – thị xã Điện Bàn – tỉnh Quảng Nam.\nLoại hình sản phẩm: Biệt thự đảo, biệt thự ở kết hợp kinh doanh\nQuy mô: 67 căn biệt thự siêu sang để bán và Regal Food\nĐơn vị phát triển: Regal Homes\nChủ đầu tư: Đất Xanh Miền Trung\nVận hành và khai thác: Smart Property\nĐơn vị phân phối: Công ty Cổ phần Đô Thị Thông Minh Việt Nam (Vietnam Smart City)\n2, Vị trí:\nRegal Victoria sở hữu vị trí sinh thái cho một cuộc sống hòa mình vào thiên nhiên xanh mát – gần biển, ven sông, sở hữu hồ sinh thái và kênh đào điều hòa ngay bên trong dự án.\nNơi đây cũng là tâm điểm phồn hoa và sẽ sớm nằm trên hai cung đường quan trọng nối liền Đà Nẵng, Hội An – cung đường bộ Võ Nguyên Giáp ven biển và cung đường thủy đang được triển khai thông qua đề án khơi thông sông Cổ Cò.\nTừ đây, Regal Victoria sẽ trở thành tâm điểm du lịch, nghỉ dưỡng sinh thái đắc địa cho du khách trên tuyến du lịch được yêu thích nhất của du khách khi tới Việt Nam: Đà Nẵng – Hội An.\n\nChủ đầu tư\nĐất Xanh Miền Trung\nThành lập từ\nN/A\nSố dự án\n13\nTháng 11/2003 thương hiệu Ðất Xanh chính thức có mặt trên thị truờng bất động sản Việt Nam. Trải qua 13 năm hình thành và phát triển, Ðất Xanh luôn vững vàng với mục tiêu mang lại cho khách hàng những sản phẩm bất động sản tốt nhất bằng dịch vụ chuyên nghiệp nhất.Với tiềm lực mạnh về tài chính, vững vàng về kinh nghiệm, cùng đội ngũ cán bộ nhân viên được đào tạo chuyên nghiệp, nhiệt tình, năng động, sáng tạo và làm việc hiệu quả, Ðất Xanh nỗ lực không ngừng trong mọi hoàn cảnh để khẳng định và nâng cao vị thế của mình trên thị trường bất động sản Việt Nam, giữ vững niềm tin trong tâm trí khách hàng và đối tác.Tự tin với sức mạnh của ba mũi nhọn là Ðầu tư - Xây dựng - Dịch vụ, Ðất Xanh đã và đang khẳng định vị thế là Nhà cung cấp giải pháp bất động sản toàn diện nhằm tạo lập cuộc sống ưu việt cho khách hàng.Với chiến lược đa ngành nghề, đa sở hữu và đa quốc gia, Đất Xanh chủ trương liên doanh, liên kết, hợp tác với các tổ chức Tài chính, Ngân hàng, Công nghệ, Nhân lực...nhằm tối ưu hóa lợi thế cạnh tranh trên thị trường. Đất Xanh là một trong những doanh nghiệp có được nét văn hóa riêng, tạo được môi trường lý tưởng cho mọi người phát triển sự nghiệp trong lĩnh vực bất động sản, đồng thời đề cao mục tiêu phát triển doanh nghiệp gắn với sự phát triển xã hội, luôn có những hành động thiết thực chung tay vì một cộng đồng bền vững và nhân ái.",
    "chiTiet": " width=device-width, initial-scale=1 Thông tin Dự án Regal Victoria-Khởi công 01/0001-Bàn giao 01/0001-Chủ đầu tư Đất Xanh Miền Trung-Loại hình Biệt thự, liền kề-Quy mô 67 căn biệt thự siêu sang-Tiến độ Đang thi công-Trạng thái Đang mở bán index, follow, noarchive Regal Victoria Thị xã Điện Bàn, Quảng Nam cập nhật tháng 7/2025 Thông tin Dự án Regal Victoria-Khởi công 01/0001-Bàn giao 01/0001-Chủ đầu tư Đất Xanh Miền Trung-Loại hình Biệt thự, liền kề-Quy mô 67 căn biệt thự siêu sang-Tiến độ Đang thi công-Trạng thái Đang mở bán https://tracuuquyhoach.com/du-an/regal-victoria-pj4810 https://tracuuquyhoach.com/open_graph.jpg website summary_large_image Regal Victoria Thị xã Điện Bàn, Quảng Nam cập nhật tháng 7/2025 Thông tin Dự án Regal Victoria-Khởi công 01/0001-Bàn giao 01/0001-Chủ đầu tư Đất Xanh Miền Trung-Loại hình Biệt thự, liền kề-Quy mô 67 căn biệt thự siêu sang-Tiến độ Đang thi công-Trạng thái Đang mở bán https://tracuuquyhoach.com/open_graph.jpg",
    "tongVonDauTu": null,
    "congTrinhCongCong": null
}