{
    "id": 8413,
    "tenDuAn": "Regal Dragon Quy Nhơn",
    "matDoXayDung": null,
    "dienTich": "1.4 ha",
    "khoiCong": "Tháng 01/0001",
    "loaiHinh": "Biệt thự, liền kề",
    "banGiaoDuKien": "Tháng 01/0001",
    "chuDauTu": "Đất Xanh Miền Trung",
    "trangThai": "Sắp mở bán",
    "viTri": "Phường Trần Quang Diệu, Thành phố Qui Nhơn, Bình Định",
    "congTyThietKe": null,
    "viTriDesc": null,
    "tienIch": "Sắp mở bán\nĐang thi công\n\nThông tin dự án\nGiá mua bán\nN/A\nGiá cho thuê\nN/A\nKhởi công\nTháng 01/0001\nBàn giao\nTháng 01/0001\nChủ đầu tư\nĐất Xanh Miền Trung\nLoại hình\nBiệt thự, liền kề\nTổng diện tích\n1.4 ha\nQuy mô\n59 căn shophouse\nTiến độ\nĐang thi công\nTrạng thái\nSắp mở bán\n\nGiới thiệu dự án\n1, Tổng quan:\nRegal Dragon Quy Nhơn là dự án khu nhà ở liền kề kết hợp thương mại cho Công ty CP Đất Xanh Miền Trung đầu tư tại TP. Quy Nhơn, Bình Định. Quy mô dự án gồm 59 căn shophouse nằm ở giao điểm các trục đường lớn, có một mặt giáp sông.\n2, Vị trí:\nDự án Regal Dragon Quy Nhơn nằm trong KĐT Long Vân, được triển khai tại mặt tiền đường Long Vân – Long Mỹ, phường Trần Quang Diệu, TP. Quy Nhơn, Bình Định. Dự án có 1 mặt view nhánh sông Hà Thanh và 1 mặt tiếp giáp đường Long Vân – Long Mỹ rộng 40m. Đây cũng là cửa ngõ để vào trung tâm TP. Quy Nhơn thông qua 2 tuyến đường Hùng Vương và Tây Sơn (QL 1D).\nĐối diện công viên Long Vân\n2km đến trường THPT Hùng Vương\n3 km đến Bệnh viện Lao và bệnh phổi tỉnh Bình Định\n25km đến sân bay Phù Cát\n3, Tiện ích:\nKhu nhà ở kết hợp thương mại Regal Dragon Quy Nhơn được đầu tư phát triển hệ thống tiện ích sinh hoạt và thương mại - giải trí ven sông hấp dẫn như khu công viên - cảnh quan ven sông, đường dạo bộ, sân khấu nhạc nước,…\nBên cạnh đó, dự án Regal Dragon được triển khai tại khu dân cư hiện hữu nên dễ dàng tiếp cận các tiện ích dân sinh như chợ truyền thống, trung tâm mua sắm, dịch vụ vui chơi - giải trí, cơ sở giáo dục, y tế ở khu vực lân cận và khu trung tâm TP. Quy Nhơn.\n4, Thiết kế:\nDự án Regal Dragon Quy Nhơn được quy hoạch trên khu đất rộng 13.502m2, phát triển 59 căn nhà phố thương mai (shophouse) cao 4 tầng với tổng diện tích hơn 6.366m2, còn lại là đất cây xanh và đất giao thông, hạ tầng kỹ thuật.\nCác sản phẩm shophouse Regal Dragon Quy Nhơn có diện tích từ 92,5 – 110 – 120 – 138 m2 mỗi lô. Một số lô lớn có diện tích lên đến 189,6m2 và 216,6m2.\n\nChủ đầu tư\nĐất Xanh Miền Trung\nThành lập từ\nN/A\nSố dự án\n13\nTháng 11/2003 thương hiệu Ðất Xanh chính thức có mặt trên thị truờng bất động sản Việt Nam. Trải qua 13 năm hình thành và phát triển, Ðất Xanh luôn vững vàng với mục tiêu mang lại cho khách hàng những sản phẩm bất động sản tốt nhất bằng dịch vụ chuyên nghiệp nhất.Với tiềm lực mạnh về tài chính, vững vàng về kinh nghiệm, cùng đội ngũ cán bộ nhân viên được đào tạo chuyên nghiệp, nhiệt tình, năng động, sáng tạo và làm việc hiệu quả, Ðất Xanh nỗ lực không ngừng trong mọi hoàn cảnh để khẳng định và nâng cao vị thế của mình trên thị trường bất động sản Việt Nam, giữ vững niềm tin trong tâm trí khách hàng và đối tác.Tự tin với sức mạnh của ba mũi nhọn là Ðầu tư - Xây dựng - Dịch vụ, Ðất Xanh đã và đang khẳng định vị thế là Nhà cung cấp giải pháp bất động sản toàn diện nhằm tạo lập cuộc sống ưu việt cho khách hàng.Với chiến lược đa ngành nghề, đa sở hữu và đa quốc gia, Đất Xanh chủ trương liên doanh, liên kết, hợp tác với các tổ chức Tài chính, Ngân hàng, Công nghệ, Nhân lực...nhằm tối ưu hóa lợi thế cạnh tranh trên thị trường. Đất Xanh là một trong những doanh nghiệp có được nét văn hóa riêng, tạo được môi trường lý tưởng cho mọi người phát triển sự nghiệp trong lĩnh vực bất động sản, đồng thời đề cao mục tiêu phát triển doanh nghiệp gắn với sự phát triển xã hội, luôn có những hành động thiết thực chung tay vì một cộng đồng bền vững và nhân ái.",
    "tinh": 9,
    "quanHuyen": null,
    "xaPhuong": null,
    "images": "https://cdn.chotot.com/u-j7fvJeTxbZ1118qySHco-q8sFhZp-NNnL12uuWwXs/preset:property_project_large/plain/4806_floor_plan_project_1666942947.jpg,https://cdn.chotot.com/6hklvckEACprHtA2eNqMWtsCTnbkX9eh2sxm51M-vdI/preset:property_project_large/plain/4806_overview_1666942728.jpg,https://cdn.chotot.com/quwRtMwMVXDr8Jx5yGb9E8ZqnYp7tbGBRUQQyUGVSrM/preset:property_project_large/plain/4806_overview_1666942772.jpg,https://cdn.chotot.com/SW9BlkdDP-XE3kZ7XwLGloUXqLYrCtL4Ajs0ETDRGZA/preset:property_project_large/plain/4806_overview_1666942820.jpg,https://cdn.chotot.com/1z90JwQereTJY68ddVrNkH4sJKlFi5g4oXI1InHCstc/preset:property_project_large/plain/4806_overview_1666942797.jpg,https://cdn.chotot.com/xvwUtBmrqltO9NlJpuPrcPKVyo6Aq624MYB8danSZOY/preset:property_project_large/plain/4806_overview_1666942905.jpg,https://cdn.chotot.com/u-j7fvJeTxbZ1118qySHco-q8sFhZp-NNnL12uuWwXs/preset:property_project_large/plain/4806_floor_plan_project_1666942947.jpg,https://cdn.chotot.com/6hklvckEACprHtA2eNqMWtsCTnbkX9eh2sxm51M-vdI/preset:property_project_large/plain/4806_overview_1666942728.jpg,https://cdn.chotot.com/quwRtMwMVXDr8Jx5yGb9E8ZqnYp7tbGBRUQQyUGVSrM/preset:property_project_large/plain/4806_overview_1666942772.jpg,https://cdn.chotot.com/SW9BlkdDP-XE3kZ7XwLGloUXqLYrCtL4Ajs0ETDRGZA/preset:property_project_large/plain/4806_overview_1666942820.jpg,https://cdn.chotot.com/1z90JwQereTJY68ddVrNkH4sJKlFi5g4oXI1InHCstc/preset:property_project_large/plain/4806_overview_1666942797.jpg,https://cdn.chotot.com/xvwUtBmrqltO9NlJpuPrcPKVyo6Aq624MYB8danSZOY/preset:property_project_large/plain/4806_overview_1666942905.jpg,https://cdn.chotot.com/u-j7fvJeTxbZ1118qySHco-q8sFhZp-NNnL12uuWwXs/preset:property_project_large/plain/4806_floor_plan_project_1666942947.jpg",
    "toaDo": "13.765107, 109.219616",
    "polygon": "[[13.765677374722292,109.21904012560844],[13.765206298011686,109.2200553417206],[13.76265745686497,109.21805441379549],[13.763048470190967,109.21737849712373],[13.764168892151162,109.21861767768861],[13.765677374722292,109.21904012560844]]",
    "donViThiCong": null,
    "dienTichXayDung": null,
    "dienTichSanXayDung": null,
    "dienTichMin": null,
    "dienTichMax": null,
    "gia_cung_khu_vuc": null,
    "giaMinPerM2": null,
    "giaMin": null,
    "soTangCao": null,
    "soTangHam": null,
    "soLuongCanHo": null,
    "soLuongDatNen": null,
    "soLuongBietThu": null,
    "soLuongNhaMatDat": null,
    "link": "https://tracuuquyhoach.com/du-an/regal-dragon-quy-nhon-pj4806",
    "test": null,
    "gioiThieu": "Sắp mở bán\nĐang thi công\n\nThông tin dự án\nGiá mua bán\nN/A\nGiá cho thuê\nN/A\nKhởi công\nTháng 01/0001\nBàn giao\nTháng 01/0001\nChủ đầu tư\nĐất Xanh Miền Trung\nLoại hình\nBiệt thự, liền kề\nTổng diện tích\n1.4 ha\nQuy mô\n59 căn shophouse\nTiến độ\nĐang thi công\nTrạng thái\nSắp mở bán\n\nGiới thiệu dự án\n1, Tổng quan:\nRegal Dragon Quy Nhơn là dự án khu nhà ở liền kề kết hợp thương mại cho Công ty CP Đất Xanh Miền Trung đầu tư tại TP. Quy Nhơn, Bình Định. Quy mô dự án gồm 59 căn shophouse nằm ở giao điểm các trục đường lớn, có một mặt giáp sông.\n2, Vị trí:\nDự án Regal Dragon Quy Nhơn nằm trong KĐT Long Vân, được triển khai tại mặt tiền đường Long Vân – Long Mỹ, phường Trần Quang Diệu, TP. Quy Nhơn, Bình Định. Dự án có 1 mặt view nhánh sông Hà Thanh và 1 mặt tiếp giáp đường Long Vân – Long Mỹ rộng 40m. Đây cũng là cửa ngõ để vào trung tâm TP. Quy Nhơn thông qua 2 tuyến đường Hùng Vương và Tây Sơn (QL 1D).\nĐối diện công viên Long Vân\n2km đến trường THPT Hùng Vương\n3 km đến Bệnh viện Lao và bệnh phổi tỉnh Bình Định\n25km đến sân bay Phù Cát\n3, Tiện ích:\nKhu nhà ở kết hợp thương mại Regal Dragon Quy Nhơn được đầu tư phát triển hệ thống tiện ích sinh hoạt và thương mại - giải trí ven sông hấp dẫn như khu công viên - cảnh quan ven sông, đường dạo bộ, sân khấu nhạc nước,…\nBên cạnh đó, dự án Regal Dragon được triển khai tại khu dân cư hiện hữu nên dễ dàng tiếp cận các tiện ích dân sinh như chợ truyền thống, trung tâm mua sắm, dịch vụ vui chơi - giải trí, cơ sở giáo dục, y tế ở khu vực lân cận và khu trung tâm TP. Quy Nhơn.\n4, Thiết kế:\nDự án Regal Dragon Quy Nhơn được quy hoạch trên khu đất rộng 13.502m2, phát triển 59 căn nhà phố thương mai (shophouse) cao 4 tầng với tổng diện tích hơn 6.366m2, còn lại là đất cây xanh và đất giao thông, hạ tầng kỹ thuật.\nCác sản phẩm shophouse Regal Dragon Quy Nhơn có diện tích từ 92,5 – 110 – 120 – 138 m2 mỗi lô. Một số lô lớn có diện tích lên đến 189,6m2 và 216,6m2.\n\nChủ đầu tư\nĐất Xanh Miền Trung\nThành lập từ\nN/A\nSố dự án\n13\nTháng 11/2003 thương hiệu Ðất Xanh chính thức có mặt trên thị truờng bất động sản Việt Nam. Trải qua 13 năm hình thành và phát triển, Ðất Xanh luôn vững vàng với mục tiêu mang lại cho khách hàng những sản phẩm bất động sản tốt nhất bằng dịch vụ chuyên nghiệp nhất.Với tiềm lực mạnh về tài chính, vững vàng về kinh nghiệm, cùng đội ngũ cán bộ nhân viên được đào tạo chuyên nghiệp, nhiệt tình, năng động, sáng tạo và làm việc hiệu quả, Ðất Xanh nỗ lực không ngừng trong mọi hoàn cảnh để khẳng định và nâng cao vị thế của mình trên thị trường bất động sản Việt Nam, giữ vững niềm tin trong tâm trí khách hàng và đối tác.Tự tin với sức mạnh của ba mũi nhọn là Ðầu tư - Xây dựng - Dịch vụ, Ðất Xanh đã và đang khẳng định vị thế là Nhà cung cấp giải pháp bất động sản toàn diện nhằm tạo lập cuộc sống ưu việt cho khách hàng.Với chiến lược đa ngành nghề, đa sở hữu và đa quốc gia, Đất Xanh chủ trương liên doanh, liên kết, hợp tác với các tổ chức Tài chính, Ngân hàng, Công nghệ, Nhân lực...nhằm tối ưu hóa lợi thế cạnh tranh trên thị trường. Đất Xanh là một trong những doanh nghiệp có được nét văn hóa riêng, tạo được môi trường lý tưởng cho mọi người phát triển sự nghiệp trong lĩnh vực bất động sản, đồng thời đề cao mục tiêu phát triển doanh nghiệp gắn với sự phát triển xã hội, luôn có những hành động thiết thực chung tay vì một cộng đồng bền vững và nhân ái.",
    "chiTiet": " width=device-width, initial-scale=1 Thông tin Dự án Regal Dragon Quy Nhơn-Khởi công 01/0001-Bàn giao 01/0001-Chủ đầu tư Đất Xanh Miền Trung-Loại hình Biệt thự, liền kề-Tổng diện tích 1.4 ha-Quy mô 59 căn shophouse-Tiến độ Đang thi công-Trạng thái Sắp mở bán index, follow, noarchive Regal Dragon Quy Nhơn Thành phố Qui Nhơn, Bình Định cập nhật tháng 7/2025 Thông tin Dự án Regal Dragon Quy Nhơn-Khởi công 01/0001-Bàn giao 01/0001-Chủ đầu tư Đất Xanh Miền Trung-Loại hình Biệt thự, liền kề-Tổng diện tích 1.4 ha-Quy mô 59 căn shophouse-Tiến độ Đang thi công-Trạng thái Sắp mở bán https://tracuuquyhoach.com/du-an/regal-dragon-quy-nhon-pj4806 https://cdn.chotot.com/6hklvckEACprHtA2eNqMWtsCTnbkX9eh2sxm51M-vdI/preset:property_project_large/plain/4806_overview_1666942728.jpg website summary_large_image Regal Dragon Quy Nhơn Thành phố Qui Nhơn, Bình Định cập nhật tháng 7/2025 Thông tin Dự án Regal Dragon Quy Nhơn-Khởi công 01/0001-Bàn giao 01/0001-Chủ đầu tư Đất Xanh Miền Trung-Loại hình Biệt thự, liền kề-Tổng diện tích 1.4 ha-Quy mô 59 căn shophouse-Tiến độ Đang thi công-Trạng thái Sắp mở bán https://cdn.chotot.com/6hklvckEACprHtA2eNqMWtsCTnbkX9eh2sxm51M-vdI/preset:property_project_large/plain/4806_overview_1666942728.jpg",
    "tongVonDauTu": null,
    "congTrinhCongCong": null
}