{
    "id": 8423,
    "tenDuAn": "La Queenara Hội An",
    "matDoXayDung": null,
    "dienTich": "200 ha",
    "khoiCong": "Tháng 07/2021",
    "loaiHinh": "Khu nghỉ dưỡng",
    "banGiaoDuKien": "Tháng 01/0001",
    "chuDauTu": "Phát Triển Đô Thị Bắc Hội An",
    "trangThai": "Đang mở bán",
    "viTri": "Phường Điện Dương, Thị xã Điện Bàn, Quảng Nam",
    "congTyThietKe": null,
    "viTriDesc": null,
    "tienIch": "Đang mở bán\nĐang thi công\n\nThông tin dự án\nGiá mua bán\nTừ 60.000.000/m2\nGiá cho thuê\nN/A\nKhởi công\nTháng 07/2021\nBàn giao\nTháng 01/0001\nChủ đầu tư\nPhát Triển Đô Thị Bắc Hội An\nLoại hình\nKhu nghỉ dưỡng\nTổng diện tích\n200 ha\nQuy mô\n1000 căn Shoptel, Boutique Hotel, Hometel, biệt thự\nTiến độ\nĐang thi công\nTrạng thái\nĐang mở bán\n\nGiới thiệu dự án\nDự án La Queenara Hội An nằm tại vị trí trung tâm đường Điện Dương, Điện Bàn, Tỉnh Quảng Nam kết nối tâm điểm các khu du lịch nổi tiếng nhất cả nước thu hút nhiều khách du lịch từ trong nước đến nước ngoài, là dự án khu đô thị nghĩ dưỡng phức hợp đầu tiên tại Việt Nam. Dự án La Queenara Hội An\ncó quy mô lên đến 200ha, sở hữu hơn 200 tiện ích nghỉ dưỡng cao cấp đạt tiêu chuẩn 5 sao cùng bến thuyền và bãi biển riêng. La Queenara Hội An được phát triển với mục tiêu trở thành một di sản về quy hoạch, kiến trúc, cảnh quan và phong cách sống, góp phần thay đổi diện mạo đô thị cũng như ngành du lịch của Quảng Nam và khu vực miền Trung, đưa bất động sản nghỉ dưỡng Việt Nam vươn tầm thế giới. Dự án do Công ty TNHH Phát triển Đô thị Bắc Hội An làm chủ đầu tư.\n1, Vị trí:\nKhu đô thị nghỉ dưỡng phức hợp La Queenara Hội An nằm trên địa phận phường Điện Dương, thị xã Điện Bàn, tỉnh Quảng Nam, sở hữu \"vị trí kim cương\" tại trung điểm trên tuyến đường huyết mạch nối liền Đà Nẵng - Hội An. Dự án nằm bên dòng sông Cổ Cò thơ mộng và sở hữu bãi biển riêng trong bãi biển An Bàng - top 50 bãi biển đẹp nhất thế giới. Ví trí dự án La Queenara Hội An có 4 mặt tiếp giáp như sau:\nPhía Bắc giáp đường Lạc Long Quân\nPhía Nam giáp sông Cổ Cò\nPhía Đông giáp Cẩm An – Hội An\nPhía Tây giáp đường nối ra quốc lộ và đường Đông Trường Sơn\n2, Tiện ích:\nHơn 200 tiện ích nghỉ dưỡng cao cấp:\nTiện ích điểm nhấn: Đường hầm sang biển, World Coffee Factory, Đại lộ Bốn Mùa, Quảng trường trung tâm, PEAKHOMES Gallery,…\nTiện ích nghỉ dưỡng: Bãi biển An Bàng, Sân golf,  Spa chăm sóc sức khỏe, Nhà hàng ẩm thực Queenie, Hệ thống bể bơi và khu thể thao đa năng,…\nTiện ích an cư: Hệ thống giáo dục liên cấp quốc tế Skyline, Nhà trẻ, Trung tâm thương mại, Phòng khám đa khoa quốc tế,…\nTiện ích tiểu khu\n:\nBể bơi ốc đảo và trẻ em,  Thác tràn, Ghế tắm nắng, Vườn nướng BBQ, Vườn Âu & tiểu cảnh, Đài phun nước, Sân chơi trẻ em, Khu cafe ngoài trời, Lối đi dạo, Khu tập yoga, Khu thể thao ngoài trời, Vườn thiền,…\n\nChủ đầu tư\nCông Ty TNHH Phát Triển Đô Thị Bắc Hội An\nThành lập từ\nN/A\nSố dự án\n1",
    "tinh": 47,
    "quanHuyen": null,
    "xaPhuong": null,
    "images": "https://cdn.chotot.com/Y_W4Pblt2iVihzcr44dULb3_scLdu_JkN7urpKwxoPo/preset:property_project_large/plain/4796_overview_1657196094.jpg,https://cdn.chotot.com/UokCOfb7QjerO8wd5GwY6ZFTjxPHOAoIn6GYHc4dCW0/preset:property_project_large/plain/4796_overview_1657195925.jpg,https://cdn.chotot.com/JV764n_6VWFweXFG9Z0p9I1P4mmEkiEnad220k5U4zU/preset:property_project_large/plain/4796_overview_1657195976.jpg,https://cdn.chotot.com/mm3gUAt0Vd9BxeItcanIZkr_yfkw4x-_2YkSodtn6WQ/preset:property_project_large/plain/4796_overview_1657196016.jpg,https://cdn.chotot.com/WxE7mHtklUh6ScysV4M3y621VhOCMnTQjgkPnAo-Obg/preset:property_project_large/plain/4796_overview_1657196056.jpg,https://cdn.chotot.com/Y_W4Pblt2iVihzcr44dULb3_scLdu_JkN7urpKwxoPo/preset:property_project_large/plain/4796_overview_1657196094.jpg,https://cdn.chotot.com/UokCOfb7QjerO8wd5GwY6ZFTjxPHOAoIn6GYHc4dCW0/preset:property_project_large/plain/4796_overview_1657195925.jpg,https://cdn.chotot.com/JV764n_6VWFweXFG9Z0p9I1P4mmEkiEnad220k5U4zU/preset:property_project_large/plain/4796_overview_1657195976.jpg,https://cdn.chotot.com/mm3gUAt0Vd9BxeItcanIZkr_yfkw4x-_2YkSodtn6WQ/preset:property_project_large/plain/4796_overview_1657196016.jpg,https://cdn.chotot.com/WxE7mHtklUh6ScysV4M3y621VhOCMnTQjgkPnAo-Obg/preset:property_project_large/plain/4796_overview_1657196056.jpg,https://cdn.chotot.com/Y_W4Pblt2iVihzcr44dULb3_scLdu_JkN7urpKwxoPo/preset:property_project_large/plain/4796_overview_1657196094.jpg",
    "toaDo": "15.915012, 108.325373",
    "polygon": "[[15.914992706850997,108.3240044116974],[15.916075093413365,108.32568883895875],[15.915878942967735,108.32711577415468],[15.914877540339956,108.32808136940004],[15.913618037165744,108.32642912864686],[15.913824513636945,108.3249056339264],[15.914992706850997,108.3240044116974]]",
    "donViThiCong": null,
    "dienTichXayDung": null,
    "dienTichSanXayDung": null,
    "dienTichMin": null,
    "dienTichMax": null,
    "gia_cung_khu_vuc": null,
    "giaMinPerM2": null,
    "giaMin": null,
    "soTangCao": null,
    "soTangHam": null,
    "soLuongCanHo": null,
    "soLuongDatNen": null,
    "soLuongBietThu": null,
    "soLuongNhaMatDat": null,
    "link": "https://tracuuquyhoach.com/du-an/la-queenara-hoi-an-pj4796",
    "test": null,
    "gioiThieu": "Đang mở bán\nĐang thi công\n\nThông tin dự án\nGiá mua bán\nTừ 60.000.000/m2\nGiá cho thuê\nN/A\nKhởi công\nTháng 07/2021\nBàn giao\nTháng 01/0001\nChủ đầu tư\nPhát Triển Đô Thị Bắc Hội An\nLoại hình\nKhu nghỉ dưỡng\nTổng diện tích\n200 ha\nQuy mô\n1000 căn Shoptel, Boutique Hotel, Hometel, biệt thự\nTiến độ\nĐang thi công\nTrạng thái\nĐang mở bán\n\nGiới thiệu dự án\nDự án La Queenara Hội An nằm tại vị trí trung tâm đường Điện Dương, Điện Bàn, Tỉnh Quảng Nam kết nối tâm điểm các khu du lịch nổi tiếng nhất cả nước thu hút nhiều khách du lịch từ trong nước đến nước ngoài, là dự án khu đô thị nghĩ dưỡng phức hợp đầu tiên tại Việt Nam. Dự án La Queenara Hội An\ncó quy mô lên đến 200ha, sở hữu hơn 200 tiện ích nghỉ dưỡng cao cấp đạt tiêu chuẩn 5 sao cùng bến thuyền và bãi biển riêng. La Queenara Hội An được phát triển với mục tiêu trở thành một di sản về quy hoạch, kiến trúc, cảnh quan và phong cách sống, góp phần thay đổi diện mạo đô thị cũng như ngành du lịch của Quảng Nam và khu vực miền Trung, đưa bất động sản nghỉ dưỡng Việt Nam vươn tầm thế giới. Dự án do Công ty TNHH Phát triển Đô thị Bắc Hội An làm chủ đầu tư.\n1, Vị trí:\nKhu đô thị nghỉ dưỡng phức hợp La Queenara Hội An nằm trên địa phận phường Điện Dương, thị xã Điện Bàn, tỉnh Quảng Nam, sở hữu \"vị trí kim cương\" tại trung điểm trên tuyến đường huyết mạch nối liền Đà Nẵng - Hội An. Dự án nằm bên dòng sông Cổ Cò thơ mộng và sở hữu bãi biển riêng trong bãi biển An Bàng - top 50 bãi biển đẹp nhất thế giới. Ví trí dự án La Queenara Hội An có 4 mặt tiếp giáp như sau:\nPhía Bắc giáp đường Lạc Long Quân\nPhía Nam giáp sông Cổ Cò\nPhía Đông giáp Cẩm An – Hội An\nPhía Tây giáp đường nối ra quốc lộ và đường Đông Trường Sơn\n2, Tiện ích:\nHơn 200 tiện ích nghỉ dưỡng cao cấp:\nTiện ích điểm nhấn: Đường hầm sang biển, World Coffee Factory, Đại lộ Bốn Mùa, Quảng trường trung tâm, PEAKHOMES Gallery,…\nTiện ích nghỉ dưỡng: Bãi biển An Bàng, Sân golf,  Spa chăm sóc sức khỏe, Nhà hàng ẩm thực Queenie, Hệ thống bể bơi và khu thể thao đa năng,…\nTiện ích an cư: Hệ thống giáo dục liên cấp quốc tế Skyline, Nhà trẻ, Trung tâm thương mại, Phòng khám đa khoa quốc tế,…\nTiện ích tiểu khu\n:\nBể bơi ốc đảo và trẻ em,  Thác tràn, Ghế tắm nắng, Vườn nướng BBQ, Vườn Âu & tiểu cảnh, Đài phun nước, Sân chơi trẻ em, Khu cafe ngoài trời, Lối đi dạo, Khu tập yoga, Khu thể thao ngoài trời, Vườn thiền,…\n\nChủ đầu tư\nCông Ty TNHH Phát Triển Đô Thị Bắc Hội An\nThành lập từ\nN/A\nSố dự án\n1",
    "chiTiet": " width=device-width, initial-scale=1 Thông tin Dự án La Queenara Hội An-Giá bán từ 60.000.000/m2-Khởi công 07/2021-Bàn giao 01/0001-Chủ đầu tư Phát Triển Đô Thị Bắc Hội An-Loại hình Khu nghỉ dưỡng -Tổng diện tích 200 ha-Quy mô 1000 căn Shoptel, Boutique Hotel, Hometel, biệt thự-Tiến độ Đang thi công-Trạng thái Đang mở bán index, follow, noarchive La Queenara Hội An Thị xã Điện Bàn, Quảng Nam cập nhật tháng 7/2025 Thông tin Dự án La Queenara Hội An-Giá bán từ 60.000.000/m2-Khởi công 07/2021-Bàn giao 01/0001-Chủ đầu tư Phát Triển Đô Thị Bắc Hội An-Loại hình Khu nghỉ dưỡng -Tổng diện tích 200 ha-Quy mô 1000 căn Shoptel, Boutique Hotel, Hometel, biệt thự-Tiến độ Đang thi công-Trạng thái Đang mở bán https://tracuuquyhoach.com/du-an/la-queenara-hoi-an-pj4796 https://cdn.chotot.com/UokCOfb7QjerO8wd5GwY6ZFTjxPHOAoIn6GYHc4dCW0/preset:property_project_large/plain/4796_overview_1657195925.jpg website summary_large_image La Queenara Hội An Thị xã Điện Bàn, Quảng Nam cập nhật tháng 7/2025 Thông tin Dự án La Queenara Hội An-Giá bán từ 60.000.000/m2-Khởi công 07/2021-Bàn giao 01/0001-Chủ đầu tư Phát Triển Đô Thị Bắc Hội An-Loại hình Khu nghỉ dưỡng -Tổng diện tích 200 ha-Quy mô 1000 căn Shoptel, Boutique Hotel, Hometel, biệt thự-Tiến độ Đang thi công-Trạng thái Đang mở bán https://cdn.chotot.com/UokCOfb7QjerO8wd5GwY6ZFTjxPHOAoIn6GYHc4dCW0/preset:property_project_large/plain/4796_overview_1657195925.jpg",
    "tongVonDauTu": null,
    "congTrinhCongCong": null
}