{
    "id": 8429,
    "tenDuAn": "Sun Casa Central",
    "matDoXayDung": null,
    "dienTich": "30 ha",
    "khoiCong": "Tháng 01/2018",
    "loaiHinh": "Khu phức hợp",
    "banGiaoDuKien": "Tháng 07/2022",
    "chuDauTu": "Công ty Liên Doanh VSIP",
    "trangThai": "Đã bàn giao",
    "viTri": "Xã Vĩnh Tân, Thị xã Tân Uyên, Bình Dương",
    "congTyThietKe": null,
    "viTriDesc": null,
    "tienIch": "Đã bàn giao\nĐang thi công\n\nThông tin dự án\nGiá mua bán\nTừ 27.000.000/m2\nGiá cho thuê\nN/A\nKhởi công\nTháng 01/2018\nBàn giao\nTháng 07/2022\nChủ đầu tư\nCông ty Liên Doanh VSIP\nLoại hình\nKhu phức hợp\nTổng diện tích\n30 ha\nQuy mô\n879 sản phẩm\nTiến độ\nĐang thi công\nTrạng thái\nĐã bàn giao\n\nGiới thiệu dự án\n1, Tổng quan:\nSun Casa Central là dự án khu đô thị do VSIP đầu tư với định hướng mang lại môi trường sống tiện nghi, hiện đại nhưng vẫn chú trọng đến việc phát triển không gian xanh đậm chất Singapore.\nKhu đất triển khai dự án có quy mô 30ha, nằm tại trung tâm Khu đô thị, công nghiệp - dịch vụ VSIP II thuộc phường Vĩnh Tân, TX. Tân Uyên, tỉnh Bình Dương. Sau khi hoàn thiện, Sun Casa Central sẽ cung ứng cho thị trường 879 sản phẩm nhà phố thương mại, nhà phố liên kế, biệt thự đơn lập và biệt thự song lập.\nSun Casa Central được ví như một Singapore thu nhỏ giữa trung tâm Tân Uyên, hội tụ đầy đủ các yếu tố của một khu đô thị chuẩn mực, đồng bộ, hiện đại và thông minh. Dự án có 879 căn, bao gồm các loại hình nhà phố liền kề, nhà phố thương mại (Shophouse), Biệt thự song lập, Biệt thự đơn lập. Các căn nhà có diện tích đất xây dựng từ 100 - 150 - 200m2, được thiết kế hiện đại, tinh tế và hài hòa giữa công năng và thẩm mỹ, đem lại giá trị sử dụng tối ưu. Sự khác biệt lớn mà VSIP đem lại cho Sun Casa Central chính là mật độ phủ xanh toàn dự án lên đến 40%. Các công viên xanh được phân bổ hợp lý bên trong nội khu, điều này giúp phần lớn các căn nhà đều sở hữu tầm nhìn toàn cảnh ra mảng xanh rộng lớn.\n2, Vị trí:\nKhu đô thị Sun Casa Central nằm tại trung tâm Khu Đô Thị, Công nghiệp & Dịch vụ VSIP II, Vĩnh Tân, TX. Tân Uyên, Bình Dương - khu vực giao điểm nối giữa Khu Công Nghiệp VSIP II với Trung tâm Tp. Mới Bình Dương. Từ vị trí này, việc kết nối với các khu vực kế cận sẽ rất thuận tiện thông qua các tuyến giao thông huyết mạch kề bên như DT 742 (1Km), Mỹ Phước - Tân Vạn, Vành đai 4 (2km), DT 741 (5km), QL 13 (7km), QL 1A (20km)...\n\nChủ đầu tư\nCông ty Việt Nam Singapore Liên Doanh TNHH Khu Công Nghiệp (VSIP)\nThành lập từ\nN/A\nSố dự án\n8",
    "tinh": 8,
    "quanHuyen": null,
    "xaPhuong": null,
    "images": "https://cdn.chotot.com/VpVCtaX9aVOQlfJVqMewEh9TiLAXgsU0HDbIvkrN7wo/preset:property_project_large/plain/4791_surrounding_1654612515.jpg,https://cdn.chotot.com/zoyetIyfHvNZwVhtJtCSlzz8NIQQl1N834avZTI_hIk/preset:property_project_large/plain/4791_overview_1654612308.jpg,https://cdn.chotot.com/-GeHnt07YBriqXXYiRYYYXpeZNhiH5Ps3e_kd_Wo43g/preset:property_project_large/plain/4791_overview_1654612344.jpg,https://cdn.chotot.com/XiVAokQH3VYxN-kW2kSJSQ71-p-Q3RZJCJGvnSY1uOg/preset:property_project_large/plain/4791_overview_1654612370.jpg,https://cdn.chotot.com/FTLokzImudqOIT9U8Dhhgx1F9kEUrEfgIN-p722oKSE/preset:property_project_large/plain/4791_facilities_1654612412.jpg,https://cdn.chotot.com/OgZ_E9hwMkd-qv0ziKfcdrA1zNgSYPowVA4rk6ik_CE/preset:property_project_large/plain/4791_facilities_1654612446.jpg,https://cdn.chotot.com/VpVCtaX9aVOQlfJVqMewEh9TiLAXgsU0HDbIvkrN7wo/preset:property_project_large/plain/4791_surrounding_1654612515.jpg,https://cdn.chotot.com/zoyetIyfHvNZwVhtJtCSlzz8NIQQl1N834avZTI_hIk/preset:property_project_large/plain/4791_overview_1654612308.jpg,https://cdn.chotot.com/-GeHnt07YBriqXXYiRYYYXpeZNhiH5Ps3e_kd_Wo43g/preset:property_project_large/plain/4791_overview_1654612344.jpg,https://cdn.chotot.com/XiVAokQH3VYxN-kW2kSJSQ71-p-Q3RZJCJGvnSY1uOg/preset:property_project_large/plain/4791_overview_1654612370.jpg,https://cdn.chotot.com/FTLokzImudqOIT9U8Dhhgx1F9kEUrEfgIN-p722oKSE/preset:property_project_large/plain/4791_facilities_1654612412.jpg,https://cdn.chotot.com/OgZ_E9hwMkd-qv0ziKfcdrA1zNgSYPowVA4rk6ik_CE/preset:property_project_large/plain/4791_facilities_1654612446.jpg,https://cdn.chotot.com/VpVCtaX9aVOQlfJVqMewEh9TiLAXgsU0HDbIvkrN7wo/preset:property_project_large/plain/4791_surrounding_1654612515.jpg",
    "toaDo": "11.135319, 106.702774",
    "polygon": "[[11.136256953068145,106.70187145471574],[11.136229386279938,106.70428276062013],[11.13281663935529,106.70428276062013],[11.132795572892022,106.70187950134279],[11.134617816328932,106.70310258865358],[11.136256953068145,106.70187145471574]]",
    "donViThiCong": null,
    "dienTichXayDung": null,
    "dienTichSanXayDung": null,
    "dienTichMin": null,
    "dienTichMax": null,
    "gia_cung_khu_vuc": null,
    "giaMinPerM2": null,
    "giaMin": null,
    "soTangCao": null,
    "soTangHam": null,
    "soLuongCanHo": null,
    "soLuongDatNen": null,
    "soLuongBietThu": null,
    "soLuongNhaMatDat": null,
    "link": "https://tracuuquyhoach.com/du-an/sun-casa-central-pj4791",
    "test": null,
    "gioiThieu": "Đã bàn giao\nĐang thi công\n\nThông tin dự án\nGiá mua bán\nTừ 27.000.000/m2\nGiá cho thuê\nN/A\nKhởi công\nTháng 01/2018\nBàn giao\nTháng 07/2022\nChủ đầu tư\nCông ty Liên Doanh VSIP\nLoại hình\nKhu phức hợp\nTổng diện tích\n30 ha\nQuy mô\n879 sản phẩm\nTiến độ\nĐang thi công\nTrạng thái\nĐã bàn giao\n\nGiới thiệu dự án\n1, Tổng quan:\nSun Casa Central là dự án khu đô thị do VSIP đầu tư với định hướng mang lại môi trường sống tiện nghi, hiện đại nhưng vẫn chú trọng đến việc phát triển không gian xanh đậm chất Singapore.\nKhu đất triển khai dự án có quy mô 30ha, nằm tại trung tâm Khu đô thị, công nghiệp - dịch vụ VSIP II thuộc phường Vĩnh Tân, TX. Tân Uyên, tỉnh Bình Dương. Sau khi hoàn thiện, Sun Casa Central sẽ cung ứng cho thị trường 879 sản phẩm nhà phố thương mại, nhà phố liên kế, biệt thự đơn lập và biệt thự song lập.\nSun Casa Central được ví như một Singapore thu nhỏ giữa trung tâm Tân Uyên, hội tụ đầy đủ các yếu tố của một khu đô thị chuẩn mực, đồng bộ, hiện đại và thông minh. Dự án có 879 căn, bao gồm các loại hình nhà phố liền kề, nhà phố thương mại (Shophouse), Biệt thự song lập, Biệt thự đơn lập. Các căn nhà có diện tích đất xây dựng từ 100 - 150 - 200m2, được thiết kế hiện đại, tinh tế và hài hòa giữa công năng và thẩm mỹ, đem lại giá trị sử dụng tối ưu. Sự khác biệt lớn mà VSIP đem lại cho Sun Casa Central chính là mật độ phủ xanh toàn dự án lên đến 40%. Các công viên xanh được phân bổ hợp lý bên trong nội khu, điều này giúp phần lớn các căn nhà đều sở hữu tầm nhìn toàn cảnh ra mảng xanh rộng lớn.\n2, Vị trí:\nKhu đô thị Sun Casa Central nằm tại trung tâm Khu Đô Thị, Công nghiệp & Dịch vụ VSIP II, Vĩnh Tân, TX. Tân Uyên, Bình Dương - khu vực giao điểm nối giữa Khu Công Nghiệp VSIP II với Trung tâm Tp. Mới Bình Dương. Từ vị trí này, việc kết nối với các khu vực kế cận sẽ rất thuận tiện thông qua các tuyến giao thông huyết mạch kề bên như DT 742 (1Km), Mỹ Phước - Tân Vạn, Vành đai 4 (2km), DT 741 (5km), QL 13 (7km), QL 1A (20km)...\n\nChủ đầu tư\nCông ty Việt Nam Singapore Liên Doanh TNHH Khu Công Nghiệp (VSIP)\nThành lập từ\nN/A\nSố dự án\n8",
    "chiTiet": " width=device-width, initial-scale=1 Thông tin Dự án Sun Casa Central-Giá bán từ 27.000.000/m2-Khởi công 01/2018-Bàn giao 07/2022-Chủ đầu tư Công ty Liên Doanh VSIP-Loại hình Khu phức hợp-Tổng diện tích 30 ha-Quy mô 879 sản phẩm-Tiến độ Đang thi công-Trạng thái Đã bàn giao index, follow, noarchive Sun Casa Central Thị xã Tân Uyên, Bình Dương cập nhật tháng 7/2025 Thông tin Dự án Sun Casa Central-Giá bán từ 27.000.000/m2-Khởi công 01/2018-Bàn giao 07/2022-Chủ đầu tư Công ty Liên Doanh VSIP-Loại hình Khu phức hợp-Tổng diện tích 30 ha-Quy mô 879 sản phẩm-Tiến độ Đang thi công-Trạng thái Đã bàn giao https://tracuuquyhoach.com/du-an/sun-casa-central-pj4791 https://cdn.chotot.com/zoyetIyfHvNZwVhtJtCSlzz8NIQQl1N834avZTI_hIk/preset:property_project_large/plain/4791_overview_1654612308.jpg website summary_large_image Sun Casa Central Thị xã Tân Uyên, Bình Dương cập nhật tháng 7/2025 Thông tin Dự án Sun Casa Central-Giá bán từ 27.000.000/m2-Khởi công 01/2018-Bàn giao 07/2022-Chủ đầu tư Công ty Liên Doanh VSIP-Loại hình Khu phức hợp-Tổng diện tích 30 ha-Quy mô 879 sản phẩm-Tiến độ Đang thi công-Trạng thái Đã bàn giao https://cdn.chotot.com/zoyetIyfHvNZwVhtJtCSlzz8NIQQl1N834avZTI_hIk/preset:property_project_large/plain/4791_overview_1654612308.jpg",
    "tongVonDauTu": null,
    "congTrinhCongCong": null
}